{
  "model": "pantomatrix",
  "fps": 4,
  "source": "demo only",
  "frames": [
    {"root":{"position":[0,0,0]},"joints":{"chest":{"rotation":[0,0,0,1]},"leftUpperArm":{"rotation":[0,0,0.18,0.9837]},"rightUpperArm":{"rotation":[0,0,-0.18,0.9837]}}},
    {"root":{"position":[0,0.005,0]},"joints":{"chest":{"rotation":[0,0.035,0,0.9994]},"leftUpperArm":{"rotation":[0.05,0,0.34,0.9391]},"rightUpperArm":{"rotation":[0.03,0,-0.25,0.9678]},"leftForeArm":{"rotation":[0,0,0.24,0.9708]},"rightForeArm":{"rotation":[0,0,-0.18,0.9837]}}},
    {"root":{"position":[0,0,0]},"joints":{"chest":{"rotation":[0,-0.025,0,0.9997]},"leftUpperArm":{"rotation":[0.03,0,0.20,0.9794]},"rightUpperArm":{"rotation":[0.05,0,-0.38,0.9235]},"leftForeArm":{"rotation":[0,0,0.13,0.9915]},"rightForeArm":{"rotation":[0,0,-0.27,0.9629]}}},
    {"root":{"position":[0,0.003,0]},"joints":{"chest":{"rotation":[0,0.02,0,0.9998]},"leftUpperArm":{"rotation":[0.04,0,0.30,0.9531]},"rightUpperArm":{"rotation":[0.02,0,-0.21,0.9775]},"leftForeArm":{"rotation":[0,0,0.21,0.9777]},"rightForeArm":{"rotation":[0,0,-0.16,0.9871]}}},
    {"root":{"position":[0,0,0]},"joints":{"chest":{"rotation":[0,0,0,1]},"leftUpperArm":{"rotation":[0,0,0.18,0.9837]},"rightUpperArm":{"rotation":[0,0,-0.18,0.9837]}}}
  ]
}
